,0,1
0,Sharpie Marker Set of 12's Fine Point in Assorted Colors,350.0 PHP
1,Sharpie permanent marker 24's | ANDREA,622.0 PHP
2,Sharpie Fine Point Black Permanent Marker,40.0 PHP
3,sharpie permanent marker 4's ( 2 tips in 1 marker),245.0 PHP
4,sharpie permanent marker 12's set,412.0 PHP
5,Sharpie Fine Marker 1pc (Multi-colors),34.0 PHP
6,Sharpie Fine Point Black Permanent Marker,40.0 PHP
7,Sharpie Permanent marker fine,28.0 PHP
8,Sharpie Permanent Markers Sharpie Fine Tip Colored Markers Fine Permanent Markers,45.0 PHP
9,Sharpie Permanent Marker Chisel Tip Black 4's,80.0 PHP
10,Sharpie Permanent Black Marker,30.0 PHP
11,"3pcs Sharpie Fine Point Permanent Marker Black, Blue, Red",99.0 PHP
12,Sharpie Marker Set of 12's Fine Point in Assorted Colors,350.0 PHP
13,Sharpie Extra Fine Oil Based Paint Marker,250.0 PHP
14,Sharpie Highlighter Pocket style and tank Style,38.0 PHP
15,Sharpie Fine Point Marker,46.0 PHP
16,Sharpie Permanent Markers Sharpie Ultra-Fine Tip Colored Markers Ultra-Fine Permanent Markers,45.0 PHP
17,Sharpie Twin Tip 2 in 1 Permanent Pen and Marker Fine,68.0 PHP
18,Sharpie Permanent Marker Fine Point - Black,55.0 PHP
19,[FPS FairPriceSupplies] Sharpie Fine Point Permanent Marker Pen (Black Blue Red Ink Color),39.0 PHP
20,Sharpie Ultra Fine Point Permanent Markers Limited Edition and Classic Colors PRICE PER PIECE,60.0 PHP
21,Sharpie Pocket Style Highlighter,48.0 PHP
22,Sharpie Fine 10CT with Reusable Cup Gift Set,370.0 PHP
23,Sharpie Twin Tip Marker Black / Fine and Ultra Fine Point Double Tip,62.0 PHP
24,Sharpie Tank Style Highlighter,48.0 PHP
25,sharpie Fine point marker original,33.0 PHP
26,Sharpie Fine Oil Based Paint Marker,250.0 PHP
27,Sharpie fine tip pen (black),40.0 PHP
28,Sharpie Pocket Highlighter Yellow 4 + 2,190.0 PHP
29,[FPS FairPriceSupplies] Sharpie Smear Guard Tank Chisel Neon Highlighters,35.0 PHP
30,Sharpie Highligter Tank Style Smear Guard in Asstd Color,38.0 PHP
31,Sharpie Permanent Twin Tip Ultrafine and Fine,65.0 PHP
32,Sharpie Twin Tip Marker Black / Fine and Ultra Fine Point Double Tip,69.0 PHP
33,Sharpie Permanent Markers 24+1,620.0 PHP
34,Sharpie Pocket Style Highlighter in Neon Colors,38.0 PHP
35,Sharpie Retractable Fine Black 3s,190.0 PHP
36,Sharpie S-Note Creative Marker Set Sharpie Color Marker Pastel Color Coloring Marker Highlighter,1000.0 PHP
37,Sharpie Fine Point 12 Colors Asstd.,353.0 PHP
38,Sharpie Oil Based Marker Medium Point oil-based marker white,300.0 PHP
39,Sharpie Tank Highlighter Chisel Tip Fluorescent Yellow Green Orange Blue Pink,35.0 PHP
40,Sharpie Tank/ Pocket Highlighters,50.0 PHP
41,2pcs Sharpie Fine Point Permanent Marker Asstd. Colors,85.0 PHP
42,✨SALE✨ Sharpie Fine Point Permanent Markers Per Piece,50.0 PHP
43,Sharpie Fine Point Permanent Marker set of 24+1 Metallic Limited Edition,650.0 PHP
44,"3pcs Sharpie METALLIC Fine Point Marker in GOLD, BRONZE and SILVER",194.0 PHP
45,Sharpie Art Pens with Hard Case Fine Point 16 Pieces AS179,770.0 PHP
46,"3pcs Sharpie METALLIC Fine Point Marker in GOLD, BRONZE and SILVER",194.0 PHP
47,Painting Needle Pens Makers Fast Dry Waterproof Porous-Point Pens Brush Journal Writing Professional Sketching,20.0 PHP
48,Touch 30/60/80/168Colors Twin Tip Pen Marker Set Dual Head Oily Alcoholic Sketch Markers Brush Pen,288.0 PHP
49,Sharpie - Tank Highlighter - Box of 36 Highlighters - Fluorescent Yellow,1125.0 PHP
